{
  "$schema": "http://json-schema.org/draft-07/schema#",
  "title": "Open CoT RFC 0011 - Conformance, Registry, and Compatibility Rules",
  "type": "object",
  "additionalProperties": false,
  "properties": {
    "registry_version": {
      "type": "string"
    },
    "profile": {
      "type": "string",
      "enum": [
        "core",
        "runtime-boundary",
        "full"
      ]
    },
    "schemas": {
      "type": "object",
      "additionalProperties": {
        "type": "string"
      }
    },
    "required_examples": {
      "type": "array",
      "items": {
        "type": "string"
      }
    }
  },
  "required": [
    "registry_version",
    "profile",
    "schemas"
  ],
  "$id": "https://opencot.dev/schemas/rfc-0011-conformance-registry.json",
  "x-opencot": {
    "rfc": "0011",
    "shortname": "conformance_registry",
    "source_rfc": "rfcs/0011-conformance-registry.md"
  }
}
